{
  "$schema": "https://json-schema.org/draft/2020-12/schema",
  "$id": "https://webuildconsortium.eu/schemas/ds-membership-sd-jwt.json",
  "title": "WE BUILD - Membership Credential - SD-JWT VC payload",
  "description": "Schema for the SD-JWT VC payload of a Membership Credential as defined in the rb-ds-membership Rulebook (Chapter 3.2). This models the JSON claims set prior to SD-JWT disclosure/packing, aligned with the catalog baseline of HAIP draft-03 and SD-JWT VC draft -09.",
  "type": "object",
  "version": "0.6.0",
  "additionalProperties": false,
  "$defs": {
    "identifier": {
      "description": "An identifier together with the scheme it belongs to. SD-JWT VC form of the typed literal described in Rulebook Section 2.2.3; the W3C VCDM encoding uses {\"@type\", \"@value\"}. Where no scheme from code list 2.8 applies, a plain string.",
      "oneOf": [
        {
          "type": "object",
          "additionalProperties": false,
          "properties": {
            "scheme": {
              "type": "string",
              "minLength": 1,
              "description": "Identifier scheme, published as a named individual by the European Business Wallet Vocabulary. See Rulebook code list 2.8.",
              "examples": [
                "Euid",
                "VatId",
                "PublicSectorBodyId",
                "Lei",
                "Eori",
                "Tin"
              ]
            },
            "value": {
              "type": "string",
              "minLength": 1,
              "description": "The identifier value, in the scheme given by scheme.",
              "examples": [
                "BEEUID0123456789",
                "BE0123456789"
              ]
            }
          },
          "required": [
            "scheme",
            "value"
          ]
        },
        {
          "type": "string",
          "minLength": 1,
          "description": "Untyped identifier, used where the scheme has no individual published in the vocabulary (for example the KMG-MID used by the DADS platform).",
          "examples": [
            "1234567"
          ]
        }
      ]
    },
    "evidenceEntry": {
      "type": "object",
      "description": "One identification means presented by, or verified for, the holder during the initial onboarding process. See Rulebook Section 2.6.1.",
      "additionalProperties": true,
      "properties": {
        "identifier": {
          "allOf": [
            {
              "$ref": "#/$defs/identifier"
            }
          ],
          "description": "The identifier by which the holder's identity was proven during onboarding."
        }
      },
      "required": [
        "identifier"
      ]
    },
    "economicOperator": {
      "type": "object",
      "description": "An economic operator, identified by its legal name and an identifier. See Rulebook Section 2.2.3.",
      "additionalProperties": true,
      "properties": {
        "legalName": {
          "type": "string",
          "minLength": 1,
          "description": "Official legal name of the economic operator.",
          "examples": [
            "Farm Example BV"
          ]
        },
        "legalIdentifier": {
          "allOf": [
            {
              "$ref": "#/$defs/identifier"
            }
          ],
          "description": "The stable, EU-level identifier. Scheme is Euid or PublicSectorBodyId (range of the legalIdentifier property). Used by member."
        },
        "identifier": {
          "description": "Further identifiers of the economic operator, in any scheme from code list 2.8. Repeatable: an operator may be known by several schemes at once. Used by onboardedBy.operator, and optionally by member to carry identifiers of the holder additional to legalIdentifier, which remains authoritative (IR-04).",
          "oneOf": [
            {
              "type": "array",
              "minItems": 1,
              "items": {
                "$ref": "#/$defs/identifier"
              }
            },
            {
              "$ref": "#/$defs/identifier"
            }
          ]
        }
      }
    }
  },
  "properties": {
    "iss": {
      "type": "string",
      "minLength": 1,
      "format": "uri",
      "description": "Issuer identifier. For the SD-JWT VC profile this is normally the onboarding service provider HTTPS URL.",
      "examples": [
        "https://djustconnect.be"
      ]
    },
    "iat": {
      "type": "integer",
      "minimum": 0,
      "description": "Issued-at timestamp as a JWT NumericDate.",
      "examples": [
        1782205200
      ]
    },
    "nbf": {
      "type": "integer",
      "minimum": 0,
      "description": "Not-before timestamp as a JWT NumericDate, where used.",
      "examples": [
        1782205200
      ]
    },
    "exp": {
      "type": "integer",
      "minimum": 0,
      "description": "Expiration timestamp as a JWT NumericDate.",
      "examples": [
        1813741200
      ]
    },
    "jti": {
      "type": "string",
      "minLength": 1,
      "description": "Unique credential instance identifier.",
      "examples": [
        "urn:uuid:8d6f0e3c-1c2a-4e2b-9f1a-1234567890ab"
      ]
    },
    "vct": {
      "type": "string",
      "const": "eu.we-build.ds-membership.1",
      "description": "Verifiable Credential Type for the Membership Credential."
    },
    "attestation_legal_category": {
      "type": "string",
      "const": "EAA",
      "description": "Legal category of the attestation. In EBWV v0.1, EAA denotes the non-qualified Electronic Attestation of Attributes category."
    },
    "id": {
      "type": "string",
      "minLength": 1,
      "description": "DID of the credential subject. May change, in contrast to member.legalIdentifier. DS-specific name retained for interoperability.",
      "examples": [
        "did:web:example.com:participant:123"
      ]
    },
    "member": {
      "allOf": [
        {
          "$ref": "#/$defs/economicOperator"
        }
      ],
      "description": "The holder of the credential, as an economic operator. member.legalIdentifier carries the stable, EU-level identifier; for the MVP this re-uses the EUID from the holder's EUBWOID. DS-specific name retained for interoperability.",
      "required": [
        "legalName",
        "legalIdentifier"
      ]
    },
    "memberOf": {
      "type": "string",
      "format": "uri",
      "minLength": 1,
      "description": "DSI or dataspace membership value. An absolute IRI registered in Rulebook code list 2.8, under the owning DSI's or dataspace's own domain. The memberOf property is typed @id in the European Business Wallet Vocabulary, so the value is an IRI and not a plain label.",
      "examples": [
        "https://agri-x.eu",
        "https://djustconnect.be"
      ]
    },
    "holderIdentifier": {
      "type": "string",
      "minLength": 1,
      "description": "Stable and unique identifier used within the DSI or dataspace to refer to THE HOLDER. Populated only where it differs from member.legalIdentifier, and intended for a platform-local reference that has no published identifier scheme; where a published scheme applies, use member.identifier instead. Subject to integrity rules IR-06 and IR-07.",
      "examples": [
        "DC-2026-004711"
      ]
    },
    "role": {
      "description": "The roles the holder has within the DSI or dataspace. Each value is an absolute IRI; those registered in Rulebook code list 2.8 are the DataSpaceRole individuals under https://w3id.org/ebwv#. A DSI may mint further role IRIs under a namespace it owns. A single role may appear as a scalar rather than a one-element array; both forms are accepted. See Rulebook Section 3.3.1.",
      "oneOf": [
        {
          "type": "array",
          "minItems": 1,
          "items": {
            "type": "string",
            "format": "uri",
            "minLength": 1,
            "examples": [
              "https://w3id.org/ebwv#DataRightsHolder",
              "https://w3id.org/ebwv#DataProvider",
              "https://w3id.org/ebwv#DataConsumer",
              "https://w3id.org/ebwv#Operator",
              "https://w3id.org/ebwv#OnboardingServiceProvider"
            ]
          }
        },
        {
          "type": "string",
          "format": "uri",
          "minLength": 1
        }
      ]
    },
    "termsOfUse": {
      "type": "object",
      "description": "Dataspace governance rulebook information. See Rulebook Section 2.2.1.",
      "additionalProperties": true,
      "properties": {
        "url": {
          "type": "string",
          "format": "uri",
          "description": "Reference to the online dataspace governance rulebook.",
          "examples": [
            "https://agri-x.eu/rulebook"
          ]
        },
        "version": {
          "type": "string",
          "minLength": 1,
          "description": "Version of the online rulebook at the time of acceptance.",
          "examples": [
            "1.2"
          ]
        },
        "hash": {
          "type": "string",
          "pattern": "^[A-Fa-f0-9]{64}$",
          "description": "SHA-256 hash of the rulebook, represented as 64 hexadecimal characters.",
          "examples": [
            "9f86d081884c7d659a2feaa0c55ad015a3bf4f1b2b0b822cd15d6c15b0f00a08"
          ]
        },
        "acceptedAt": {
          "type": "string",
          "format": "date-time",
          "description": "Datetime when the rulebook was accepted, where present. Subject to integrity rule IR-01.",
          "examples": [
            "2026-06-20T14:30:00Z"
          ]
        }
      },
      "required": [
        "url",
        "version",
        "hash"
      ]
    },
    "onboardedBy": {
      "type": "object",
      "description": "The platform through which the holder was onboarded: the platform itself and the economic operator hosting it. Describes the onboarding party only; how the holder was identified is recorded in evidence. See Rulebook Section 2.2.2.",
      "additionalProperties": true,
      "properties": {
        "platformId": {
          "type": "string",
          "minLength": 1,
          "description": "DID identifying the platform through which the holder was onboarded.",
          "examples": [
            "did:web:djustconnect.be"
          ]
        },
        "name": {
          "type": "string",
          "minLength": 1,
          "description": "Commercial name of the platform (DSI or onboarding partner).",
          "examples": [
            "DjustConnect"
          ]
        },
        "operator": {
          "allOf": [
            {
              "$ref": "#/$defs/economicOperator"
            }
          ],
          "description": "The economic operator hosting and running the platform. Its identifier identifies that organisation, NOT the holder.",
          "required": [
            "legalName",
            "identifier"
          ]
        }
      },
      "required": [
        "platformId",
        "name",
        "operator"
      ]
    },
    "evidence": {
      "description": "The identification means used to prove the holder's identity during the initial onboarding process. Describes the HOLDER, never the platform or its operator. Subject to integrity rules IR-03 and IR-04. A single entry may appear as an object rather than a one-element array; both forms are accepted. See Rulebook Sections 2.6.1 and 3.3.1.",
      "oneOf": [
        {
          "type": "array",
          "minItems": 1,
          "items": {
            "$ref": "#/$defs/evidenceEntry"
          }
        },
        {
          "$ref": "#/$defs/evidenceEntry"
        }
      ]
    },
    "status": {
      "type": "object",
      "description": "Status-list revocation information.",
      "additionalProperties": false,
      "properties": {
        "type": {
          "type": "string",
          "const": "status-list",
          "description": "Status mechanism type."
        },
        "status_list_credential": {
          "type": "string",
          "format": "uri",
          "description": "URI of the Status List Credential that contains the status bitstring.",
          "examples": [
            "https://djustconnect.be/status/membership/1"
          ]
        },
        "status_list_index": {
          "type": "integer",
          "minimum": 0,
          "description": "Zero-based index into the status list bitstring for this credential.",
          "examples": [
            42
          ]
        },
        "status_purpose": {
          "type": "string",
          "const": "revocation",
          "description": "Purpose of the status entry."
        }
      },
      "required": [
        "type",
        "status_list_credential",
        "status_list_index",
        "status_purpose"
      ]
    },
    "cnf": {
      "type": "object",
      "description": "Confirmation claims per SD-JWT VC. Used when the credential is holder-bound.",
      "additionalProperties": false,
      "properties": {
        "jwk": {
          "type": "object",
          "description": "Public key bound to the holder.",
          "additionalProperties": true,
          "properties": {
            "kty": {
              "type": "string"
            },
            "crv": {
              "type": "string"
            },
            "x": {
              "type": "string"
            },
            "y": {
              "type": "string"
            },
            "n": {
              "type": "string"
            },
            "e": {
              "type": "string"
            }
          }
        }
      },
      "required": [
        "jwk"
      ]
    }
  },
  "required": [
    "iss",
    "iat",
    "exp",
    "jti",
    "vct",
    "attestation_legal_category",
    "id",
    "member",
    "memberOf",
    "role",
    "termsOfUse",
    "onboardedBy",
    "status"
  ]
}
